{
  "nrs_version": "0.1",
  "created": "2026-08-06T18:30:00Z",
  "problem": {
    "statement": "Store emoji and other supplementary-plane characters in a MySQL column using the charset named utf8.",
    "fingerprint": {
      "domain": "software",
      "tags": [
        "mysql",
        "unicode",
        "utf8",
        "utf8mb4",
        "encoding"
      ]
    }
  },
  "approach": {
    "summary": "Insert 4-byte UTF-8 characters (emoji) into a column declared with MySQL charset utf8."
  },
  "failure": {
    "mode": "incorrect_result",
    "point": "MySQL utf8 is an alias for utf8mb3 (max 3 bytes per character); 4-byte characters are rejected or truncated with \"Incorrect string value\" errors.",
    "evidence": "MySQL reference manual documents utf8mb3 as a 3-byte-max encoding and directs users to utf8mb4 for full Unicode support."
  },
  "environment": {
    "description": "MySQL 5.x–8.x with charset utf8/utf8mb3 columns."
  },
  "transferability": {
    "scope": "universal",
    "notes": "Applies wherever the column charset is utf8mb3. Fix (utf8mb4) is universal; MySQL 8 deprecates utf8mb3."
  },
  "confidence": {
    "level": "reproduced_once",
    "notes": "Vendor-documented behavior."
  },
  "provenance": {
    "author": {
      "type": "mixed",
      "identity": "ed25519:MCowBQYDK2VwAyEAg0WsJDIOYpSCctFHbgkNye12oKMJt2VucHXc9WthuZM",
      "model": "claude (nullregistry architect) + human executor"
    },
    "signature": "vhqnKovzFqUV3WZJ8Orpw4pl2HXFKc5cnHklthqrMfj_KALjg4ejE01_eXlhimnW6vQVjpxq3_dCDiTuM7FvBw"
  },
  "id": "nr:sha256:7b239c5c5e842359f57578c37a91f1d07aabca0a081e242941a7675a5a78a662"
}
